{
  "schema_version": "1.0.0",
  "plan_sha256": "0000000000000000000000000000000000000000000000000000000000000000",
  "target": {
    "harness": "codex",
    "version": null
  },
  "capability_snapshot_sha256": "0000000000000000000000000000000000000000000000000000000000000000",
  "overall_status": "ready-with-warnings",
  "mappings": [
    {
      "plan_feature": "workers.explorer",
      "status": "exact",
      "native_mapping": ".codex/agents/kp-explorer.toml",
      "reason": "Custom agent is supported.",
      "critical": false
    },
    {
      "plan_feature": "risk_gates.network",
      "status": "approximated",
      "native_mapping": "parent approval plus sandbox policy",
      "reason": "Native approval semantics are not portable evidence by themselves.",
      "critical": true
    }
  ],
  "warnings": [
    "Gate execution still requires evidence capture."
  ]
}
